{
  "id": "canonical/wire-evidence-card-request",
  "rules": [
    "SR-1",
    "SR-3"
  ],
  "note": "The Affidavit from the protocol seed fixture `wire/evidence-card-request` (Sakwala/affiant-protocol at v0.0.1-seed), copied here unchanged so the canonical form is pinned over a shape both implementations already agree on. `confidence: 1.0` in the seed file is the JSON number 1 after parsing and serializes as `1` — a canonical form has one spelling per value. The seed's `aggregateConfidence` of 0.95 is the mean the shipped .NET projection computes, which AF-2 corrects to the minimum; the vector pins the bytes of the shape, not the correctness of the number.",
  "input": {
    "operationType": "WriteUpdate",
    "entityType": "Widget",
    "entityId": "W-1",
    "fields": [
      {
        "name": "Status",
        "value": "Active",
        "previousValue": null,
        "provenance": {
          "current": {
            "source": "UserStated",
            "confidence": 1,
            "evidence": "User stated: Status",
            "conversationTurn": null
          },
          "prior": []
        },
        "isMandatory": true,
        "kind": "enum",
        "allowedValues": [
          "Active",
          "Retired"
        ],
        "pattern": null
      },
      {
        "name": "Weight",
        "value": 12.5,
        "previousValue": 10,
        "provenance": {
          "current": {
            "source": "Conversation",
            "confidence": 0.9,
            "evidence": "Extracted from search_widget",
            "conversationTurn": 3
          },
          "prior": []
        },
        "isMandatory": false,
        "kind": "number",
        "allowedValues": null,
        "pattern": "^\\d+(\\.\\d+)?$"
      }
    ],
    "aggregateConfidence": 0.95,
    "warnings": [],
    "requiresConfirmation": true
  },
  "amendments": null,
  "reviewerAct": null,
  "expectedBytesUtf8": "{\"aggregateConfidence\":0.95,\"entityId\":\"W-1\",\"entityType\":\"Widget\",\"fields\":[{\"allowedValues\":[\"Active\",\"Retired\"],\"isMandatory\":true,\"kind\":\"enum\",\"name\":\"Status\",\"pattern\":null,\"previousValue\":null,\"provenance\":{\"current\":{\"confidence\":1,\"conversationTurn\":null,\"evidence\":\"User stated: Status\",\"source\":\"UserStated\"},\"prior\":[]},\"value\":\"Active\"},{\"allowedValues\":null,\"isMandatory\":false,\"kind\":\"number\",\"name\":\"Weight\",\"pattern\":\"^\\\\d+(\\\\.\\\\d+)?$\",\"previousValue\":10,\"provenance\":{\"current\":{\"confidence\":0.9,\"conversationTurn\":3,\"evidence\":\"Extracted from search_widget\",\"source\":\"Conversation\"},\"prior\":[]},\"value\":12.5}],\"operationType\":\"WriteUpdate\",\"requiresConfirmation\":true,\"warnings\":[]}",
  "expectedSha256": "5bd969aeb4a19bc4f54c6fadc78c83da42ab78c8d5a2d8a826851482b5a95bb0"
}
