{
  "id": "canonical/wire-evidence-card-request",
  "rules": [
    "SR-1",
    "SR-3"
  ],
  "note": "The proposal behind the protocol seed fixture `wire/evidence-card-request` (Sakwala/affiant-protocol), as the v0.1 record. The same two fields, the same values and the same grades; what changed is where they live. `allowedValues` and `pattern` are gone from the fields — v0.1 puts a reviewer surface's rendering hints on the card envelope, because nothing swears to them and a hash a grant is checked against must not move when an input is restyled (SR-3). `warnings` and `requiresConfirmation` are gone for the same reason. `confidence: 1.0` in the seed file is the JSON number 1 after parsing and serializes as `1` — a canonical form has one spelling per value. The seed's `aggregateConfidence` of 0.95 was the mean the shipped .NET projection computes; AF-2 makes it the minimum, so this record reads 0.9.",
  "input": {
    "protocolVersion": "0.1.0",
    "operationType": "update",
    "entityType": "Widget",
    "entityId": "W-1",
    "fields": [
      {
        "name": "Status",
        "kind": "enum",
        "value": "Active",
        "previousValue": null,
        "provenance": {
          "current": {
            "source": "UserStated",
            "confidence": 1,
            "note": "User stated: Status",
            "at": "2026-09-04T09:00:00.000Z",
            "conversationTurn": null,
            "binding": null
          },
          "prior": []
        },
        "isMandatory": true
      },
      {
        "name": "Weight",
        "kind": "number",
        "value": 12.5,
        "previousValue": 10,
        "provenance": {
          "current": {
            "source": "Conversation",
            "confidence": 0.9,
            "note": "Extracted from search_widget",
            "at": "2026-09-04T09:00:00.000Z",
            "conversationTurn": 3,
            "binding": null
          },
          "prior": []
        },
        "isMandatory": false
      }
    ],
    "aggregateConfidence": 0.9,
    "populatedConfidence": 0.9,
    "emptyFieldCount": 0,
    "conversationTurn": 3,
    "createdAt": "2026-09-04T09:00:00.000Z"
  },
  "amendments": null,
  "reviewerAct": null,
  "expectedBytesUtf8": "{\"aggregateConfidence\":0.9,\"conversationTurn\":3,\"createdAt\":\"2026-09-04T09:00:00.000Z\",\"emptyFieldCount\":0,\"entityId\":\"W-1\",\"entityType\":\"Widget\",\"fields\":[{\"isMandatory\":true,\"kind\":\"enum\",\"name\":\"Status\",\"previousValue\":null,\"provenance\":{\"current\":{\"at\":\"2026-09-04T09:00:00.000Z\",\"binding\":null,\"confidence\":1,\"conversationTurn\":null,\"note\":\"User stated: Status\",\"source\":\"UserStated\"},\"prior\":[]},\"value\":\"Active\"},{\"isMandatory\":false,\"kind\":\"number\",\"name\":\"Weight\",\"previousValue\":10,\"provenance\":{\"current\":{\"at\":\"2026-09-04T09:00:00.000Z\",\"binding\":null,\"confidence\":0.9,\"conversationTurn\":3,\"note\":\"Extracted from search_widget\",\"source\":\"Conversation\"},\"prior\":[]},\"value\":12.5}],\"operationType\":\"update\",\"populatedConfidence\":0.9,\"protocolVersion\":\"0.1.0\"}",
  "expectedSha256": "f621bb3e2e20e50672f0a9afba2f2d837c24a15be4592261bfd206dca48e8bbc"
}
