{
  "id": "canonical/money-and-escapes",
  "rules": [
    "SR-1",
    "SR-2"
  ],
  "note": "Money as two strings, never a number (SR-2): a GBP amount with cents a float would lose, a JPY amount with no minor units, a negative amount, and an amount far beyond what a double can hold. Alongside them the string rules: only what JSON requires is escaped, so a quote, a backslash and the C0 controls are escaped (with the two-character forms where JSON has them, lowercase u-escapes otherwise) while every non-ASCII character is written as itself and encoded as UTF-8 — an e-acute is two bytes, not six — and a solidus is never escaped. The escaping rules apply to keys and to values alike, which is why the note on one tag carries a quote of its own.",
  "input": {
    "protocolVersion": "0.1.0",
    "operationType": "update",
    "entityType": "Invoice",
    "entityId": "INV-2026-0045",
    "fields": [
      {
        "name": "Total",
        "kind": "number",
        "value": {
          "amount": "4000.10",
          "currency": "GBP"
        },
        "previousValue": {
          "amount": "0",
          "currency": "GBP"
        },
        "provenance": {
          "current": {
            "source": "Computed",
            "confidence": 1,
            "note": "Sum of the line items",
            "at": "2026-09-04T09:00:00.000Z",
            "conversationTurn": null,
            "binding": {
              "kind": "computation-ref",
              "ref": {
                "rule": "invoice.total@v3",
                "inputs": [
                  "LineItems"
                ]
              }
            }
          },
          "prior": []
        },
        "isMandatory": true
      },
      {
        "name": "Refund",
        "kind": "number",
        "value": {
          "currency": "JPY",
          "amount": "-1250"
        },
        "previousValue": null,
        "provenance": {
          "current": {
            "source": "UserStated",
            "confidence": 1,
            "note": "Reviewer typed it into the \"Refund\" box",
            "at": "2026-09-04T09:00:00.000Z",
            "conversationTurn": null,
            "binding": {
              "kind": "form-input",
              "ref": {
                "field": "Refund"
              }
            }
          },
          "prior": []
        },
        "isMandatory": false
      },
      {
        "name": "Ceiling",
        "kind": "number",
        "value": {
          "amount": "123456789012345678901234567890.99",
          "currency": "LKR"
        },
        "previousValue": null,
        "provenance": {
          "current": {
            "source": "External",
            "confidence": 1,
            "note": "Read from the ledger",
            "at": "2026-09-04T09:00:00.000Z",
            "conversationTurn": null,
            "binding": {
              "kind": "external-ref",
              "ref": {
                "system": "ledger",
                "recordId": "limit/9"
              }
            }
          },
          "prior": []
        },
        "isMandatory": false
      },
      {
        "name": "Memo",
        "kind": "text",
        "value": "quote \" backslash \\ tab \t newline \n cr \r backspace \b formfeed \f nul \u0000 unit-separator \u001f solidus a/b accented éüñ script 日本語 emoji 😀 private-use ",
        "previousValue": null,
        "provenance": {
          "current": {
            "source": "Conversation",
            "confidence": 0.7,
            "note": "Taken verbatim from the turn",
            "at": "2026-09-04T09:00:00.000Z",
            "conversationTurn": 2,
            "binding": null
          },
          "prior": []
        },
        "isMandatory": false
      }
    ],
    "aggregateConfidence": 0.7,
    "populatedConfidence": 0.7,
    "emptyFieldCount": 0,
    "conversationTurn": 2,
    "createdAt": "2026-09-04T09:00:00.000Z"
  },
  "amendments": null,
  "reviewerAct": null,
  "expectedBytesUtf8": "{\"aggregateConfidence\":0.7,\"conversationTurn\":2,\"createdAt\":\"2026-09-04T09:00:00.000Z\",\"emptyFieldCount\":0,\"entityId\":\"INV-2026-0045\",\"entityType\":\"Invoice\",\"fields\":[{\"isMandatory\":true,\"kind\":\"number\",\"name\":\"Total\",\"previousValue\":{\"amount\":\"0\",\"currency\":\"GBP\"},\"provenance\":{\"current\":{\"at\":\"2026-09-04T09:00:00.000Z\",\"binding\":{\"kind\":\"computation-ref\",\"ref\":{\"inputs\":[\"LineItems\"],\"rule\":\"invoice.total@v3\"}},\"confidence\":1,\"conversationTurn\":null,\"note\":\"Sum of the line items\",\"source\":\"Computed\"},\"prior\":[]},\"value\":{\"amount\":\"4000.10\",\"currency\":\"GBP\"}},{\"isMandatory\":false,\"kind\":\"number\",\"name\":\"Refund\",\"previousValue\":null,\"provenance\":{\"current\":{\"at\":\"2026-09-04T09:00:00.000Z\",\"binding\":{\"kind\":\"form-input\",\"ref\":{\"field\":\"Refund\"}},\"confidence\":1,\"conversationTurn\":null,\"note\":\"Reviewer typed it into the \\\"Refund\\\" box\",\"source\":\"UserStated\"},\"prior\":[]},\"value\":{\"amount\":\"-1250\",\"currency\":\"JPY\"}},{\"isMandatory\":false,\"kind\":\"number\",\"name\":\"Ceiling\",\"previousValue\":null,\"provenance\":{\"current\":{\"at\":\"2026-09-04T09:00:00.000Z\",\"binding\":{\"kind\":\"external-ref\",\"ref\":{\"recordId\":\"limit/9\",\"system\":\"ledger\"}},\"confidence\":1,\"conversationTurn\":null,\"note\":\"Read from the ledger\",\"source\":\"External\"},\"prior\":[]},\"value\":{\"amount\":\"123456789012345678901234567890.99\",\"currency\":\"LKR\"}},{\"isMandatory\":false,\"kind\":\"text\",\"name\":\"Memo\",\"previousValue\":null,\"provenance\":{\"current\":{\"at\":\"2026-09-04T09:00:00.000Z\",\"binding\":null,\"confidence\":0.7,\"conversationTurn\":2,\"note\":\"Taken verbatim from the turn\",\"source\":\"Conversation\"},\"prior\":[]},\"value\":\"quote \\\" backslash \\\\ tab \\t newline \\n cr \\r backspace \\b formfeed \\f nul \\u0000 unit-separator \\u001f solidus a/b accented éüñ script 日本語 emoji 😀 private-use \"}],\"operationType\":\"update\",\"populatedConfidence\":0.7,\"protocolVersion\":\"0.1.0\"}",
  "expectedSha256": "95bb5dbbd77fd340c16764245de08e887e807733e2983cef31c59c55467a2dc4"
}
